AuthorID,Author,Date_original,Date,Content,Attachments,Reactions,,,
7.96148E+17,charliecavecc,2022/11/20 ‰∏äÂçà12:44,2022/11/20,Hi,,,,,
9.0685E+17,istreams,2022/11/20 ‰∏äÂçà8:49,2022/11/20,Heyyy I'm interested in building a Dao but don't know where to start.,,,,,
8.07644E+17,shawnzywonzie,2022/11/20 ‰∏äÂçà9:53,2022/11/20,"Nice, well you came to the right place üôÇ What kind of DAO are you starting?",,,,,
8.07644E+17,shawnzywonzie,2022/11/20 ‰∏äÂçà9:53,2022/11/20,"Hey @Charlie Cave ""CC"" How goes it?",,,,,
9.0685E+17,istreams,2022/11/20 ‰∏äÂçà9:58,2022/11/20,What you mean? I see the Dao as a social justice Dao similar to the  assange Dao but I want it on the Aragon platform,,,,,
8.07644E+17,shawnzywonzie,2022/11/20 ‰∏äÂçà10:01,2022/11/20,"Gotcha, that should be totally possible. Have you started growing a community?",,,,,
9.0685E+17,istreams,2022/11/20 ‰∏äÂçà10:02,2022/11/20,Not yet I don't know where  to start.,,,,,
9.28679E+17,incandenza1594,2022/11/21 ‰∏äÂçà2:35,2022/11/21,"Hey @infinitystreams!We have a very detailed guide on how to build a Community, take a look! https://aragon.org/how-to/how-to-build-manage-and-grow-your-dao-community",,üî• (5),,,
8.07644E+17,shawnzywonzie,2022/11/21 ‰∏ãÂçà1:09,2022/11/21,"Yup, Thanks @Incandenza || UTC+1! 

@infinitystreams 
I would begin with making sure that you've planned out the idea for your DAO meticulously and ensure the actual day to day operations are running smoothly and you have ""gotten the ball rolling"" so to say. 

Once youve done that you will have something to start creating a community around. Then, once youve started gaining traction with your community, i would create the DAO. 

Theres no need to create a DAO (spending the money on gas, learning the App, etc.) Until these other things are in place. 

I was speaking with another community manager and we agreed that one of the biggest challenges people face when starting a DAO is skipping steps. They will start a DAO before they have people to actually participate in that DAO and then wonder why its not gaining traction. Definitely dont want this happening to you!",,üî• (3),,,
8.05982E+17,Cdogg#1999,2022/11/22 ‰∏ãÂçà5:57,2022/11/22,"Hey @Rick | Aragon @AClay, I would like to introduce you to a few members from the Hourglass team @[sunbreather] & @G-Yes95. They dropped in on the Community Welcome Call earlier today looking for some support in becoming a DAO and potentially building some extensions to plug into the new Aragon App, testing this on the new testnet first. To summarize, they are a DeFi protocol that allows for DAOs to monetize and borrow against their native tokens. Feel free to connect them with anyone else within Aragon that can help!",,üî• (2),,,
9.13108E+17,sunbreather_,2022/11/22 ‰∏ãÂçà5:58,2022/11/22,Thank you üòä,,AragonProject1 (3),,,
4.85039E+17,ricktik6,2022/11/23 ‰∏äÂçà2:56,2022/11/23,Started a thread.,,,,,
9.42798E+17,amnonma,2022/11/27 ‰∏äÂçà10:57,2022/11/27,"Hi, I am looking at the  documentations for the client apps and they mention they work in various networks but not Goerli. Is Goerli considered Mainnet?",,,,,
9.42798E+17,amnonma,2022/11/27 ‰∏äÂçà11:29,2022/11/27,I hope this is the right place to fire out questions... I am trying to familiarize myself with Aragon DAOs...,,,,,
9.42798E+17,amnonma,2022/11/27 ‰∏äÂçà11:31,2022/11/27,"So, I built a DAO from the company template. I can see the apps installed on the left side of the client. Now I opened the client on a different computer and logged in to the same DAO. Now all the apps disappeared and there is only the ""Home"" app. What is going on?",,,,,
8.71717E+17,aleuts,2022/11/27 ‰∏ãÂçà2:04,2022/11/27,"Hey friend if you are looking for more support, go here! üôÇ #üèóÔ∏±dtech-general",,,,,
9.42798E+17,amnonma,2022/11/28 ‰∏äÂçà1:42,2022/11/28,Thank you! Will doüòÄ,,,,,
9.28679E+17,incandenza1594,2022/11/28 ‰∏äÂçà2:43,2022/11/28,"Hey @Devs and @DAO Builderss, for those who missed it, here you can find the recording of the first episode of the **Aragon's product Behind the Scenes series**. I was impressed while listening to our lead engineer talking about the features of the new app, and I bet you will be too! Spoiler alert: it's going to be a game changer üòâ

Recording: https://twitter.com/AragonProject/status/1596164096948404230?s=20&t=6aBjVrXBtsEeBF_VmxSjQw

To apply for early access: https://aragon.org/aragon-app",,"memes (3),üôè (3)",,,
9.0685E+17,istreams,2022/11/29 ‰∏äÂçà11:37,2022/11/29,Thanks I will check it out,,,,,
9.0685E+17,istreams,2022/11/29 ‰∏äÂçà11:40,2022/11/29,"If I could get a mod in my discord to organize my server in the way  it needs to be done , I believe can gather a command grow it",,,,,
9.0685E+17,istreams,2022/11/29 ‰∏äÂçà11:40,2022/11/29,I need help with part first,,,,,
7.35978E+17,tnorm,2022/11/29 ‰∏ãÂçà12:50,2022/11/29,Is there an API for DAO Voting data? Trying to pull on-chain voter data/history for Lido DAO,,,,,
8.07644E+17,shawnzywonzie,2022/11/30 ‰∏äÂçà5:23,2022/11/30,@deleted-role Team. Do we have this available?,,,,,
2.5432E+17,fabsmartins,2022/11/30 ‰∏äÂçà5:25,2022/11/30,"As far as I understand, the votes are on Vocdoni chain and there used to be an API but right the API is not functioning. So right now the only way to pull voting data is manually.",,,,,
3.62186E+17,capitulation.eth,2022/11/30 ‰∏äÂçà5:40,2022/11/30,"AFAIK Lido is using a fork of the aragonOS contracts, nothing to do with Vochain. Potentially look for their instance and look at main net interactions",,,,,
8.92333E+17,smartmonie,2022/12/2 ‰∏äÂçà6:55,2022/12/2 ,hello,,,,,
8.92333E+17,smartmonie,2022/12/2 ‰∏äÂçà6:57,2022/12/2 ,i run a cooperative in Nigeria ...i like to develop it into a Dao,,,,,
8.92333E+17,smartmonie,2022/12/2 ‰∏äÂçà6:58,2022/12/2 ,do i need to be a blockchain dev in other to execute?,,,,,
8.92333E+17,smartmonie,2022/12/2 ‰∏äÂçà7:00,2022/12/2 ,im not a dev ..i need help:Soft: :Sweat:,,,,,
8.07644E+17,shawnzywonzie,2022/12/2 ‰∏äÂçà8:03,2022/12/2 ,"Not at all. You can easily create the operating system for your dao using aragon with little dev experience. We also have multiple support systems in place to help you as well. 

However I would recommend waiting until we release our new version of the app early next year. It is even easier to use than the current version. :memes:",,,,,
8.92333E+17,smartmonie,2022/12/2 ‰∏äÂçà9:32,2022/12/2 ,"I will appreciate any help I can get 
The DAO project is a very direct Defi solution ..

I like to start creating the DAO project ..ASAP
I can easily learn n assimilate as I make  progress with your support",,,,,
1.04907E+18,Dutchrevolution#0864,2022/12/4 ‰∏ãÂçà4:16,2022/12/4 ,I have a transport (dispatching) company/software i would like to decentralize with a DAO but I‚Äôm a noob. Please contact my by email vanrossummarnix@gmail.com,,,,,
8.72559E+17,dicethedev,2022/12/4 ‰∏ãÂçà10:36,2022/12/4 ,Cool,,,,,
9.28679E+17,incandenza1594,2022/12/5 ‰∏äÂçà4:48,2022/12/5 ,"Hey @SmartMonie, you're in the right place! I recommend you to join our Community Welcome Call tomorrow at 16:30 UTC, you'll get an overview of our present and upcoming tools for DAO builders and you'll have plenty of room to ask whatever questions you might have. You can RSVP here to get a reminder: https://discord.com/channels/672466989217873929/917811689225855036/1047202790008696872",,,,,
7.148E+17,raaaaaj,2022/12/6 ‰∏ãÂçà4:21,2022/12/6 ,Hi there! I'm part of the Harmony One Community DAO and we were looking at tools the Aragon platform had that we could use. We were a little confused on what Aragon has to offer and we were hoping we could have an AMA twitter space with someone from Aragon to answer questions. Our spaces are on Wednesdays @2pm PT (10pm UTC). Would this be possible?,,,,,
8.07644E+17,shawnzywonzie,2022/12/6 ‰∏ãÂçà5:25,2022/12/6 ,Started a thread.,,,,,
9.0074E+17,aslanas,2022/12/7 ‰∏äÂçà11:37,2022/12/7 ,"I'm building a protocol where participants are minted an NFT when they stake tokens, and I'd like them to be able to use their NFT to vote on governance proposals. Where each NFT will have a different voting weight assigned to it based on how many tokens they staked, how long they staked them, and some other factors. 

Does anyone know if I can customize an Aragon DAO to support voting in this way?",,,,,
8.07644E+17,shawnzywonzie,2022/12/7 ‰∏ãÂçà12:35,2022/12/7 ,Started a thread.,,,,,
7.81101E+17,fad#7144,2022/12/8 ‰∏äÂçà8:52,2022/12/8 ,"Hey everyone üëãüèæ , I'm helping build an on-chain custody solution for organisations like DAOs -- we use intelligent key management and verifiable smart contracts to offer a seamless and easy to use fully self-custodial experience across multiple chains with detailed and tiered access controls enforced on-chain coupled with other features such as web3 access. We're really looking to lower the barrier for safe self-custody for organisations.

I'm looking to learn more about how DAO's, of all sizes, approach safely storing their digital assets and managing their treasuries. And what does an ideal solution for them look like.

Any assistance means a lot, if you're willing to chat feel free to shoot me a dm or reply here and happy to take it from there.",,üî• (1),,,
9.96987E+17,muchomonero,2022/12/8 ‰∏ãÂçà1:10,2022/12/8 ,As a DAO builder with no team currently and no coding experience. What is the benefits of using Aragon over juice box to create an ERC-1155 token? My primary goal for the first round of funding would be to build up a treasury and for hiring a core team.,,,,,
6.6593E+17,wutwut_,2022/12/9 ‰∏äÂçà8:51,2022/12/9 ,Started a thread.,,,,,
9.25949E+17,l u c a s#1234,2022/12/12 ‰∏ãÂçà12:45,2022/12/12,"In search of DAO consultant for paid consultation on project in early phases. Is this a thing? I have a research brief, an NDA, and some eth. üôá",,,,,
9.25949E+17,l u c a s#1234,2022/12/12 ‰∏ãÂçà12:56,2022/12/12,https://twitter.com/metatsunami/status/1602361382795710465,,,,,
8.07644E+17,shawnzywonzie,2022/12/12 ‰∏ãÂçà2:17,2022/12/12,Started a thread.,,,,,
9.15333E+17,fmurphy,2022/12/13 ‰∏äÂçà5:31,2022/12/13,"Hi DAO Builders. Any of you out there with early stage projects looking to attract funding, check out this article reviewing 8 pitch deck templates - https://openvc.app/blog/pitch-deck-template#conclusion",,üî• (2),,,
9.28679E+17,incandenza1594,2022/12/15 ‰∏äÂçà5:36,2022/12/15,"Hey @DAO Builderss, how many among you have dreamt to own or build a sport team?  Sports DAOs are the tools that can allow you to do it even if you are not an emir or the manager of an investment fund. But they can also be used to build fan clubs, create new game leagues (both IRL and in the metaverse), and more!

Learn how to build one with our brand new guide, ***""How to start a Sports DAO""*** featuring insights from Flex Chapman, founder of Krause Haus: https://blog.aragon.org/how-to-start-a-sports-dao/",,"06 (2),sunglasses (1),Rocket (1)",,,
6.24142E+17,elemental_thorium,2022/12/16 ‰∏äÂçà5:23,2022/12/16,"Hey builders! 

Anyone who is interested in increasing the standard of security on their projects feel free to message me here or on Twitter @hxp117 

I am a BD rep for Omniscia, you can check out our reports on the website and the projects we have worked with.

We have worked with over 240 projects in just over 18 months, with a small team of highly experienced developers. 

Happy to provide more info on request.",,Rocket (2),,,
5.33072E+17,drmattbarney,2022/12/18 ‰∏ãÂçà2:00,2022/12/18,"Colleagues - I'm grateful to @Incandenza || UTC+1 and @Carla | dTech who suggested I post this question here.  I am an Organizational Psychologist, with experience with Web2 Enterprise Risk Management, and am keen on helping improve DAO risk management with, for example, psychometrics.  In traditional firms, there are dashboards that track various operational risks related to products, services and customers; as well as contextual risks around finance, and HR.  The types of risks from leaders and DAO members is where my strength lies (e.g. detect and mitigate risk in DAO members and teams).  In reading the resources Carla and Incandenza shared, I don't see these sorts of operational dashboards.  I have a vision for how these might be useful to compliment all Aragon DAOs in reducing risks, but don't want to ""reinvent the wheel"" if there are other resources I should learn about first?  Any advice, or words of redirection or encouragement would be appreciated.",,,,,
8.04037E+17,HardEight#5196,2022/12/21 ‰∏ãÂçà12:40,2022/12/21,Has anyone here actually used a DAO to build a RE fund in the United States?,,,,,
8.05982E+17,Cdogg#1999,2022/12/21 ‰∏ãÂçà2:23,2022/12/21,"This is a super common inquiry we get, in terms of people wanting to start one. For various reasons some people don‚Äôt end up following through, however it seems possible. Would need some form of real-world entity owning the DAO or visa-versa (LLC/corp etc). CityDAO as an example has purchased 2 pieces of land through their endeavours",,,,,
8.04037E+17,HardEight#5196,2022/12/21 ‰∏ãÂçà3:52,2022/12/21,"Wyoming now allows a DAO to register an LLC, so the registration side is ready. I'm trying to understand how to design it in order to use it for multiple ongoing projects, rather than a single build. Can you guys refer me to anyone that could help me on structure and governance dynamics?",,,,,
8.04037E+17,HardEight#5196,2022/12/21 ‰∏ãÂçà3:55,2022/12/21,"For instance, I want the governance token to not only allow for voting, but also be tradable on a DEX like Uniswap. I'd like to allow it to have the magnified market exposure of being tied in liquidity to ETH for instance, so that when minority owners exit the system they can sell their ETH on the open market and avoid damaging our treasury or market cap.",,,,,
8.05982E+17,Cdogg#1999,2022/12/21 ‰∏ãÂçà4:20,2022/12/21,"It‚Äôs a fairly new concept, I love these ideas, but I personally, nor would our individual team members be able to provide you with the answers. We do however have multiple teams of paid professional consultants that can provide answers and solutions via our DAO Experts program if you are interested?",,,,,
8.04037E+17,HardEight#5196,2022/12/21 ‰∏ãÂçà4:46,2022/12/21,Yes I'd love to connect to the right people. I'm currently a RE developer in the real world and we have real projects that would benefit immensely from the anonymous crowd funding benefits of a DAO.,,üöÄ (1),,,
8.05982E+17,Cdogg#1999,2022/12/21 ‰∏ãÂçà5:24,2022/12/21,"Cool! I will connect you right now, you will see a new category of channels open up as I add a new role and permissions for you. See the #bankless-consulting channel and you will see and introduction made there. Once you and their representative have added each other as friends, take it to DMs to discuss üôÇ",,,,,
8.04037E+17,HardEight#5196,2022/12/21 ‰∏ãÂçà5:26,2022/12/21,Ok I can't wait. Looking forward to getting with the right people.,,,,,
8.05982E+17,Cdogg#1999,2022/12/21 ‰∏ãÂçà5:32,2022/12/21,Done. See the #bankless-consulting channel for connection. Please feel free to share feedback on your journey as you build this out üôÇ,,,,,
4.04125E+17,youters,2022/12/25 ‰∏äÂçà5:31,2022/12/25,"Hey! I‚Äôm currently a aspiring developer in highschool that is working on building DAO tooling ontop of Aragon, more specifically pertaining to the realm of contribution authentication. I‚Äôve been working at the project for a while now, however I‚Äôve recently come to a standstill because of my lack of understanding of Aragon OS and also a lack of overall experience. I‚Äôm looking to see if these is anyone here who would graciously be willing to give me a few pointers or could help me out with some debugging!! Alternatively I‚Äôm also looking for freelancers who would be able to help build out this project. Merry Christmas and thank you all for the help!",,,,,
2.5203E+17,blaze3226,2022/12/29 ‰∏äÂçà5:33,2022/12/29,"Hello everyone, I would like to ask you, if there is any possible way to connect snapshot to my dao. If any, how ? Thank you, for your response.",,,,,
3.85169E+17,chartreaderbtc48k,2022/12/29 ‰∏ãÂçà2:15,2022/12/29,hi,,,,,
3.85169E+17,chartreaderbtc48k,2022/12/29 ‰∏ãÂçà2:16,2022/12/29,i want start Dao for trader,,,,,
9.28679E+17,incandenza1594,2022/12/30 ‰∏äÂçà3:50,2022/12/30,"Hi Blaze, do you mean on Client? Not in the current version, but I don't understand what you need snapshot for, you can hold votes on-chain through the app",,‚ù§Ô∏è (1),,,
2.5203E+17,blaze3226,2022/12/30 ‰∏äÂçà4:19,2022/12/30,"Yeah on Client, I want to take an advantage of  off-chain voting, so I can avoid  the gas fees and also use more complex voting strategies such as quadratic voting. All of this might change throughout the time.",,,,,
9.28679E+17,incandenza1594,2022/12/30 ‰∏äÂçà6:07,2022/12/30,"As far as I know this is not possible at the moment, but maybe @Brent (yellowsunshine.eth) can provide some extra help",,,,,
6.92444E+17,yellowsunshine,2022/12/30 ‰∏äÂçà11:56,2022/12/30,"Anyone can use Aragon Voice which uses something like snapshots, made by Vocdoni/Aragon Labs. Automatically executing events such as moving funds based on a vote cant be done outside of client without additional programming right now. 

You can check out the Aragon Voice docs: https://documentation.aragon.org/products/aragon-voice/how-to-create-a-proposal 
Vocdoni docs: https://documentation.aragon.org/products/aragon-vocdoni
And more technical docs on Vocdoni if you are trying to run your own instance: https://docs.vocdoni.io/",,‚ù§Ô∏è (2),,,
1.02171E+18,roaddogmantis,2022/12/31 ‰∏äÂçà11:43,2022/12/31,"I'm moving into the world of Aragon on behalf of Apecoin DAO. We just fired the centralized admin, Cartan, and I'm seeking a decentralized option moving forward. @Incandenza || UTC+1 @Brent (yellowsunshine.eth)  @Carla | dTech , how can Aragon help",,,,,
9.28679E+17,incandenza1594,2023/1/2 ‰∏äÂçà3:57,2023/1/2 ,"Hey @roaddogmantis, welcome to the community! Send me a DM to have a chat and see if/how I can help you üòâ",,,,,
1.02171E+18,roaddogmantis,2023/1/2 ‰∏äÂçà4:42,2023/1/2 ,FR sent,,üëç (1),,,
8.12719E+17,Don_Sheetal#0242,2023/1/4 ‰∏äÂçà9:47,2023/1/4 ,"Hey guys, do you think we need to launch our DAOs with ERC1155 as the token ?",,"üî• (1),üôè (1),memes (1)",,,
8.07644E+17,shawnzywonzie,2023/1/4 ‰∏äÂçà11:03,2023/1/4 ,Started a thread.,,,,,
8.12719E+17,Don_Sheetal#0242,2023/1/4 ‰∏ãÂçà3:27,2023/1/4 ,"Hi Again, if I setup on Aragon how do I then sell say 5% of the tokens to an investor with the money going to the DAO tresury and their tokens vested over say 3 years ?",,"üî• (1),üôè (1),memes (1)",,,
8.07644E+17,shawnzywonzie,2023/1/4 ‰∏ãÂçà4:08,2023/1/4 ,Started a thread.,,,,,
2.46598E+17,invictusidao,2023/1/6 ‰∏äÂçà11:30,2023/1/6 ,"IS there anyone that has suggestions for a DAO on chain bookkeeping solution with real world assets and products/services for sales to dao members ? .. 

or is the bookeeping same as any ltd/llc",,,,,
8.17835E+17,DAOLecturer#1613,2023/1/8 ‰∏äÂçà9:40,2023/1/8 ,"Hi everyone,
This is Hale Cide Demir. I am also DAO expert. I would like to use Aragon new app for the social scientists and linkedin influencers. (A kind of think tank)  But I can't. Could you help me to get a ealry  acces‚õìüåÄ",,,,,
9.15333E+17,fmurphy,2023/1/9 ‰∏äÂçà3:12,2023/1/9 ,"Hi @DAOLecturer unfortunately early access has closed and the team is preparing for general release of the new app, which is planned for March. Are you in a hurry to get access and spin up your DAO?",,,,,
1.04778E+18,Nora‚ô?5729,2023/1/10 ‰∏ãÂçà11:07,2023/1/10,"hii
Who should I speak to if I want a collaboration with you guys?",,,,,
9.28679E+17,incandenza1594,2023/1/11 ‰∏äÂçà2:57,2023/1/11,Started a thread.,,,,,
3.72262E+17,suchcool.eth,2023/1/18 ‰∏äÂçà5:11,2023/1/18,"Hey guys, 
Antoine here from consola.finance. consola.finance is a crypto bookkeeping and accounting software. We would love to partner with Aragon and provide our tool to the Aragon ecosystem. I think we could be a huge value added for Aragon. Thanks!",,,,,
9.15333E+17,fmurphy,2023/1/18 ‰∏äÂçà5:34,2023/1/18,"Hi @suchcool.eth  welcome to our discord and thanks for your interest in Aragon. I checked out your website and I would love to hear more about the tool and the features offered if you would like to DM me. We have a new app for DAO builders due for general release over the next 2-3 months, and I am sure many DAO builders will have a need for a good bookkeeping  tool.",,,,,
3.72262E+17,suchcool.eth,2023/1/18 ‰∏äÂçà6:04,2023/1/18,great news. DMed,,üëåüèΩ (1),,,
5.23257E+17,taliescript,2023/1/23 ‰∏äÂçà3:41,2023/1/23,"Hey guys,
I need some advice for my DAO, if anyone can help. 
Basically we have a representation template DAO and we use the tokens created by aragon for governance, which is fine. But we want to create a separate transferable token where minting will be controlled via votes on aragon.",,,,,
5.23257E+17,taliescript,2023/1/23 ‰∏äÂçà3:41,2023/1/23,We are on the polygon network by the way,,,,,
5.23257E+17,taliescript,2023/1/23 ‰∏äÂçà3:42,2023/1/23,"Does anyone know how this can be achieved, i am a developer by trade so don't mind writing a bit of code.",,,,,
5.23257E+17,taliescript,2023/1/23 ‰∏äÂçà3:43,2023/1/23,Thanks so much,,,,,
9.28679E+17,incandenza1594,2023/1/23 ‰∏äÂçà4:34,2023/1/23,"Uhm, good question @Rogue developer. I don't think that a minting action can be automatically triggered via proposal vote on Client (you can still create a proposal and execute it manually), and I gave a try to create a second token through Client and couldn't do it. My advice would be to create the second token using another DAO account and then, in case, transfer it, but I'm sure that @Carla | dTech can come up with a better solution üôÇ",,,,,
5.23257E+17,taliescript,2023/1/23 ‰∏äÂçà7:01,2023/1/23,"Thanks so much for your reply!
I was initially thinking to create a token and host it on the polygon network, then use the agent to control it. But I dont really know how to do that üòÖ",,,,,
9.28679E+17,incandenza1594,2023/1/23 ‰∏äÂçà9:07,2023/1/23,Try to post your question also in #‚ùìÔ∏±questions or #üèóÔ∏±dtech-general,,,,,
4.54949E+17,_carla_,2023/1/23 ‰∏äÂçà9:36,2023/1/23,"Hi, having two different tokens on the Client isn't a ready solution and honestly, I'm not sure if it is a good effort to write code to adjust it. Aragon is developing a new App that will be easier to customize. It should arrive in early March so not so far. In the meantime can you run something using a multi-sig wallet and connect with the right permissions to your DAO? Here is an example https://documentation.aragon.org/products/multisig but not sure if it can work for your requirements.",,,,,
5.20652E+17,AitorWeedAlienFlow#4290,2023/1/25 ‰∏äÂçà10:00,2023/1/25,"Hola, buenas como puedo hacer para crear mi DAO en AlienFlow.Crypto?",,,,,
9.15333E+17,fmurphy,2023/1/25 ‰∏äÂçà10:12,2023/1/25,"Hola @AitorWeedAlienFlow , mucho gusto. Nuestro DAO Tooling App nuevo lanzamiento general est√° previsto para marzo, si puedes esperar. Podr√≠a usar las herramientas actuales, es menos f√°cil de usar, pero nuestro equipo de dTech puede ayudarte. Una cosa mas, la gran majoria de nuestro comunidad no habla Espanol, sin embargo tengo ganas para ayudarte si tu no hablas Ingles.",,,,,
5.20652E+17,AitorWeedAlienFlow#4290,2023/1/25 ‰∏äÂçà10:22,2023/1/25,Gracias si genial quiero empezar cuanto antes,,,,,
9.15333E+17,fmurphy,2023/1/25 ‰∏äÂçà10:24,2023/1/25,Como si quieres. Puedes empezar aqui - https://client.aragon.org/#/,,,,,
9.28679E+17,incandenza1594,2023/1/25 ‰∏äÂçà10:34,2023/1/25,"@AitorWeedAlienFlow , tu puede consultar la documentaci√≥n en espa√±ol tambien: https://documentation.aragon.org/v/documentacion-del-usuario-de-aragon/aragon/readme.",,memes (2),,,
5.20652E+17,AitorWeedAlienFlow#4290,2023/1/25 ‰∏äÂçà10:38,2023/1/25,Ya estoy all√≠ conecte la wallet de Matic y quiero poner AlienFlow.Crypto porque ya tengo ese dominio en polygon Matic antes de que saliera ENS,,,,,
9.28679E+17,incandenza1594,2023/1/25 ‰∏äÂçà10:50,2023/1/25,"No me parece que los dominios ENS puedan utilizarse como address con client, pero quiz√° me equivoque. Seguro que @Brent (yellowsunshine.eth) o @ansonparker  pueden orientarte mejor.
De todas formas, es mejor mover esta conversaci√≥n a #‚ùìÔ∏±questions o #üèóÔ∏±dtech-general  porque este canal tiene otra funci√≥n",,üëçüèº (1),,,
4.76474E+17,ansonparker,2023/1/25 ‰∏äÂçà11:37,2023/1/25,Hola = si se puede con un poco de cambios,,,,,
5.20652E+17,AitorWeedAlienFlow#4290,2023/1/25 ‰∏ãÂçà12:23,2023/1/25,Genial gracias si me puedes ayudar o indicar,,,,,
4.76474E+17,ansonparker,2023/1/25 ‰∏ãÂçà12:50,2023/1/25,perdon - he estado buscando...,,,,,
4.76474E+17,ansonparker,2023/1/25 ‰∏ãÂçà12:50,2023/1/25,se que esta por aca... pero donde me cuesta üòâ,,,,,
