AuthorID,Author,Date_original,Date,Content,Attachments,Reactions,,,
9.0972E+17,abuusama,2023/3/25 ‰∏ãÂçà1:11,2023/3/25,"yea so there are  different strategies for managing user wallets, with account abstraction. but essentially when you first onboard your user to your dapp you dont want them to _have_ to install a bunch of stuff to try it out. the session wallets are not good for anything that requires a persistance. think of it like a temporary wallet (which it is) after the user does a few transactions it means they are much more likely to be a converted user and you can prompt them to have a more secure setup. just like when you first started out with crypto you may not even have backed up your seed but if you got a couple thousand dollars you may have invested into a hardware wallet and a brain wallet for the real bag.",,,,,
9.0972E+17,abuusama,2023/3/25 ‰∏ãÂçà1:14,2023/3/25,"but you dont have to go down that route, you can use social logins to contract wallets (the account abstraction thing) and the keys are not stored in metamask but use portis or one of the other providers that let you sign transactions with your gmail account",,,,,
9.0972E+17,abuusama,2023/3/25 ‰∏ãÂçà1:17,2023/3/25,"yea you can use openzeppelin to do your relayer but you woudnt do the ethers random wallet thing. like i was mentioning, the ""wallet"" is a smart contract and the ""owner"" still has to have some keys and a way to interact with the contract. give me one sec ill send some links",,,,,
9.0972E+17,abuusama,2023/3/25 ‰∏ãÂçà1:20,2023/3/25,"this is a video on the session keys setup
https://youtu.be/NBQEtLjN84E

and this is one is a tutorial on how to use gmail as a signer with a abstract account. 
https://youtu.be/qBPoVs66CxE",,"üöÄ (1),üëåüèΩ (1)",,,
9.0972E+17,abuusama,2023/3/25 ‰∏ãÂçà1:25,2023/3/25,"but honestly its non trivial if you are kind of new to development. IMHO try to validate your idea before trying out all these ideas. personally I love hacking on things like this. if you look at my github I have literally hundreds of repos of small hacks trying out all these cool things but if you are trying to build an actual project, try and validate the underlying idea. all these things, as cool as they are, wont make a flawed idea work, that has to be sound first and its usually the easiest and cheapest thing to test",,,,,
4.89048E+17,molnarbalazs,2023/3/25 ‰∏ãÂçà1:42,2023/3/25,"thanks, lots to read",,,,,
9.0972E+17,abuusama,2023/3/25 ‰∏ãÂçà1:49,2023/3/25,while your at it though https://biconomy.gitbook.io/sdk/introduction/overview. this is by far the easiest way to do this kind of thing and the docs are pretty good. if there is something you dont understand chat gpt can really help lol if not you can ping me and ill help out where i can,,,,,
4.89048E+17,molnarbalazs,2023/3/25 ‰∏ãÂçà1:54,2023/3/25,"it's a good intro, my env is RN-app and lambda backends, i will check to see if these packages are available on react native.",,,,,
4.89048E+17,molnarbalazs,2023/3/25 ‰∏ãÂçà1:57,2023/3/25,or maybe I can just put this service on a node backend service,,,,,
4.89048E+17,molnarbalazs,2023/3/26 ‰∏äÂçà6:34,2023/3/26,"it looks like the node https://biconomy.gitbook.io/sdk/guides/node.js/setting-up-smart-account
functions allow the creation, deployment of smart accounts and signing transactions.",,,,,
9.0972E+17,abuusama,2023/3/26 ‰∏äÂçà8:56,2023/3/26,making a thread this is dominating this chat,,üß† (1),,,
9.0972E+17,abuusama,2023/3/26 ‰∏äÂçà8:58,2023/3/26,Started a thread.,,,,,
2.5203E+17,blaze3226,2023/3/26 ‰∏ãÂçà2:07,2023/3/26,"Hey guys!
Just wanted to ask, what is the estimated time for Aragon app become full version?

Thank you for your answer!",,,,,
9.98779E+17,sametron#3065,2023/3/27 ‰∏äÂçà7:24,2023/3/27,"Hello everyone, I'm a new here, and I am a creative designer looking to start a DAO for digital 3D pixel art enthusiasts. I want to build a DAO where I can share my collection and everyone can participate, share their art, and mint NFTs. However, I'm not skilled in coding and I'm not sure where to start.",,,,,
8.07644E+17,shawnzywonzie,2023/3/27 ‰∏äÂçà7:40,2023/3/27,Started a thread.,,,,,
8.07644E+17,shawnzywonzie,2023/3/27 ‰∏äÂçà7:41,2023/3/27,Started a thread.,,,,,
6.60618E+17,eurv,2023/3/27 ‰∏äÂçà8:11,2023/3/27,Is the source code for the OSx front end app open source?,,,,,
2.10379E+17,plopmenz,2023/3/27 ‰∏äÂçà8:28,2023/3/27,https://github.com/aragon/app,,"‚ù§Ô∏è (1),üëåüèΩ (1)",,,
1.08516E+18,Andy Brownbear UK#2623,2023/3/27 ‰∏ãÂçà1:07,2023/3/27,"Hi All, I'm new here - and curious to hear from folks who have launched DAOs, or considering launching one, as we consider launching a DAO to fund projects at the intersection of music and therapy 

1) which DAO creators platforms (in addition to Aragon) did you/are you considering? 

2) what were/are the most important criteria for you in choosing the right platform? 

I'm pulling together a comparison of different DAO creators/frameworks for our own decision making- starting with Aragon, Colony, Hypha, Syndicate, DAO Haus... would love to crowdsource insights from you and also happy to share info gathered....",,,,,
8.07644E+17,shawnzywonzie,2023/3/27 ‰∏ãÂçà1:27,2023/3/27,Started a thread.,,,,,
7.51356E+17,takisoul,2023/3/29 ‰∏äÂçà7:12,2023/3/29,gm all! Quick question. Trying to deploy a test DAO on Goerli testnet but I get this error. Any reason why and how to get past it?,https://cdn.discordapp.com/attachments/1036975360551702568/1090594296517898392/Screenshot_2023-03-29_at_2.10.39_PM.png,,,,
2.10379E+17,plopmenz,2023/3/29 ‰∏äÂçà7:52,2023/3/29,"Not sure what's happening, but you could try disconnecting and reconnecting your wallet?",,üôè (1),,,
2.10379E+17,plopmenz,2023/3/29 ‰∏äÂçà7:52,2023/3/29,Idk if you use metamask or walletconnect,,,,,
2.10379E+17,plopmenz,2023/3/29 ‰∏äÂçà7:52,2023/3/29,That's just what the programmer in me would try haha,,,,,
7.51356E+17,takisoul,2023/3/29 ‰∏äÂçà7:59,2023/3/29,seemed to have worked! ty,,üî• (3),,,
8.80794E+17,juliettech,2023/3/29 ‰∏äÂçà9:22,2023/3/29,Started a thread.,,,,,
8.80794E+17,juliettech,2023/3/29 ‰∏äÂçà9:27,2023/3/29,Started a thread.,,,,,
7.51356E+17,takisoul,2023/3/29 ‰∏äÂçà11:31,2023/3/29,"Back again with another question.
I successfully deployed a test DAO on testnet then managed to create a proposal. But even though I had sent tokens to my wallet upon creation (and can see them on ethscan) when the time came to vote, proposal said I have no governance power to vote with .",,,,,
7.51356E+17,takisoul,2023/3/29 ‰∏äÂçà11:31,2023/3/29,Any reason why this happened?,,,,,
9.94586E+17,Micheal#5073,2023/3/29 ‰∏ãÂçà5:40,2023/3/29,"Hello fam üëã
Who should I contact for partnership?",,,,,
1.07359E+18,juniper_juice,2023/3/30 ‰∏äÂçà4:13,2023/3/30,"Hey Aragon team, Andrew from Guardarian Exchange here. 

I've got a suggestion to list us on your token page, as an easy & accessible onramp option for buying ANT, which we are. üôÇ
Who can I discuss this with?

All our links for reference: https://linktr.ee/guardarian",,,,,
8.07644E+17,shawnzywonzie,2023/3/30 ‰∏äÂçà8:30,2023/3/30,Started a thread.,,,,,
8.8086E+17,missjeev,2023/4/4 ‰∏ãÂçà3:36,2023/4/4 ,"Hey Aragon Team! I'm Jeevs from Notifi Network  üôÇ 

This is a partnerships inquiry - I would love to get connected to learn more and explore any ways Aragon & Notifi Network can work together. TL; DR our notification platform can facilitate any on or off chain alert automatically for your users (proposal alerts, prod / marketing alerts, custom alerts, etc.)  Aragon does not seem to have TG, SMS, Discord DMs &  Email Notifications they send their users in real-time built into the dApp - We‚Äôd love to support  & see if there are any synergies we can explore.

Can we connect?",,,,,
8.07644E+17,shawnzywonzie,2023/4/4 ‰∏ãÂçà3:58,2023/4/4 ,Started a thread.,,,,,
4.29406E+17,dmt96,2023/4/5 ‰∏äÂçà1:30,2023/4/5 ,I'm DMT Business Development from Mises Browser. I'm interested to support Aragon run on our browser. Who should I'm contacted for integration?,,,,,
6.99642E+17,javery,2023/4/5 ‰∏äÂçà6:13,2023/4/5 ,"We (nftx) run Aragon and Snapshot in parallel. 

Governance starts with a forum post which requires some quorum to move to a snapshot vote.  The snapshot vote then allows token holders to vote on the proposal in an off-chain way, which removes the burden of paying for transactions.

We then stage the outcome of the votes (whether treasury decisions or contract updates) onto Aragon and the found votes to reach the minimum quorum.  At this point people could still vote for/against, but because everyone already had their say (for free) we've never had any issues.",,,,,
8.71717E+17,aleuts,2023/4/5 ‰∏äÂçà6:24,2023/4/5 ,"Welcome Javery! Glad to have some NFTX friends in here. I was recently chatting with Gaus! It will be a few quarters but we are planning on integrating off-chain voting / gasless voting into the App, eventually with optional on-chain execution as well. Removing the need for DAOs having to hop in and out of their DAO homebase! üôÇ For now that does seem to be the standard for sure and works well!",,,,,
6.99642E+17,javery,2023/4/5 ‰∏äÂçà6:30,2023/4/5 ,Amazing news!,,,,,
6.99642E+17,javery,2023/4/5 ‰∏äÂçà6:34,2023/4/5 ,"I stopped by the stand at ETH Denver to say hello and ask some questions. Gaus has already staked the claim on the namespace for the new Aragon app, I think our rough plan is to migrate from our current DAO across to the new version.  Points to consider would be
- What to do with the token?
- What to do with the three wallets on a time-lock token distribution
- Does the new version allow for token delegation for voting? (I saw a short video about wrapping ANT tokens to wANT which allows for delegation, assume this is with the newest version)
- Timeframes around connecting/migrating historic data from older DAO versions of Aragon to the new version",,üî• (1),,,
8.71717E+17,aleuts,2023/4/5 ‰∏ãÂçà3:55,2023/4/5 ,"Hey friend! Mind dm'ing me the contract locking the accounts and the DAO address? üôÇ 
- We will have the ability to import your DAOs tokens shortly
- Will get back to you about this, need to look at the contracts with the team
- It will shortly, we are actually building the delegate voting plugin right now! So less for your team to do. üôÇ No the wANT is our tokens for our AragonDAO which is on the old stack, we will also move our DAO over in due time! üôÇ 
- TBD but i'll let you know when I get the above info 
Thank you! üôÇ",,,,,
6.99642E+17,javery,2023/4/5 ‰∏ãÂçà7:01,2023/4/5 ,"I‚Äôll pick these up in the morning and send them over, unless @gaus  picks this up before me",,,,,
9.46033E+17,Arabot#8414,2023/4/5 ‰∏ãÂçà7:01,2023/4/5 ,"Anthony Leutenegger is out of office until 2023/4/7 ‰∏ãÂçà3:57. The user gets the ping but may not respond....
Add üëç to delete this message",,,,,
8.71717E+17,aleuts,2023/4/6 ‰∏äÂçà1:58,2023/4/6 ,No rush! and hey @gaus !!!,,,,,
3.15352E+17,yikesawjeez,2023/4/10 ‰∏äÂçà1:26,2023/4/10,my god the value,,,,,
8.07644E+17,shawnzywonzie,2023/4/10 ‰∏äÂçà10:15,2023/4/10,https://tenor.com/view/what-is-that-what-is-happening-sam-neill-remove-sunglasses-gif-15770358,,,,,
8.24245E+17,arthuromniscia.io,2023/4/11 ‰∏äÂçà6:58,2023/4/11,"Gm team, not sure if this is the right place to ask but who should I contact regarding security audit proposals?",,,,,
8.07644E+17,shawnzywonzie,2023/4/11 ‰∏äÂçà8:01,2023/4/11,Started a thread.,,,,,
4.03431E+17,ka9#2013,2023/4/12 ‰∏ãÂçà3:01,2023/4/12,Is it possible  to  create  a dao that uses  an existing  token,,,,,
9.33362E+17,unchained619,2023/4/13 ‰∏äÂçà8:17,2023/4/13,"Hi guys. How suitable is aragon app for a dao that solely focusses investing in the digital asset space on the Polygon Network along with offchain investments such as assets not on the polygon network. 

Initially the DAO has experience and ability to optimize ROI but as the DAO grows i wish to scale and implement proposal and governance schemes",,,,,
9.33362E+17,unchained619,2023/4/13 ‰∏äÂçà8:18,2023/4/13,I currently use syndicate and it‚Äôs perfect for what i require but i feel it can be daunting on onboarding new users. Aragon seems to have a mobile app approach,,,,,
8.07644E+17,shawnzywonzie,2023/4/14 ‰∏äÂçà11:55,2023/4/14,"Hey @Unchained We dont have a mobile app, however our new product has been optimized for a mobile web browser. 

Re your question: I think the Aragon app is definitely suitable. We are on Polygon and you can store any of your evm compatible digital assets in an Aragon DAO. I'm not sure exactly what you mean by ""Offchain investments"" but, from what i'm getting here, anything happening offchain would essentially be a signaling vote that would need to be executed by a human agent. Unless you can utilize Aragons plug-in feature to add on this functionality to the DAO.",,,,,
1.03637E+18,_generalist,2023/4/14 ‰∏ãÂçà7:30,2023/4/14,"Hi Aragon team, for a hackathon, I am building cross chain voting and I intend to use OSX framework, but have been having some trouble understanding how plugins would work, is there any tutorial or can I DM someone in regards to my doubts thank you",,üî• (1),,,
2.10379E+17,plopmenz,2023/4/15 ‰∏äÂçà5:09,2023/4/15,"Not from the team, but am developing a plugin to, so might be able to answer your question :)",,,,,
2.99443E+17,dr0r,2023/4/15 ‰∏äÂçà11:55,2023/4/15,How do I sell my DAOs tokens? Does Aragon offer a fundraising page?,,,,,
9.0972E+17,abuusama,2023/4/15 ‰∏ãÂçà12:17,2023/4/15,Hackathon! lol,,,,,
9.0972E+17,abuusama,2023/4/15 ‰∏ãÂçà12:18,2023/4/15,give it a couple weeks there will be something üòâ,,"üî• (2),üëÄ (1),üöÄ (1)",,,
8.80794E+17,juliettech,2023/4/15 ‰∏ãÂçà1:03,2023/4/15,Started a thread.,,,,,
9.33362E+17,unchained619,2023/4/15 ‰∏ãÂçà11:36,2023/4/15,"Yeh i noticed the suitability due to compatibility with mobile browser. (A shortcut on device can be made)

In terms if offchain for eg the idea im running is to invest in digital assets not bound by the polygon ecosystem. So the dao will be operating on polygon but funds can be used to approve proposals executed to invest in assets like Litecoin, Cardano etc etc",,,,,
9.33362E+17,unchained619,2023/4/15 ‰∏ãÂçà11:42,2023/4/15,@Shawnzy i would appreciate if we can arrange a demo cal so i could discuss the idea of a investment club and align suitability with the aragon platform,,,,,
6.00238E+17,olivier1977,2023/4/18 ‰∏äÂçà6:15,2023/4/18,anyone here who canhelp me with CLI/Frame problems? I cannot get things connected and want to work with my external SCs through agent.....,,,,,
8.07644E+17,shawnzywonzie,2023/4/18 ‰∏äÂçà8:31,2023/4/18,Started a thread.,,,,,
4.03431E+17,ka9#2013,2023/4/20 ‰∏äÂçà6:19,2023/4/20,@Generalist  need a sponsor?,,,,,
1.03637E+18,_generalist,2023/4/20 ‰∏ãÂçà12:29,2023/4/20,Started a thread.,,,,,
4.91769E+17,Statbot#3472,2023/4/20 ‰∏ãÂçà12:29,2023/4/20,,https://cdn.discordapp.com/attachments/1036975360551702568/1098690645356457984/user_stats.png,,,,
4.03431E+17,ka9#2013,2023/4/21 ‰∏ãÂçà2:38,2023/4/21,Oh nice bot,,,,,
8.07644E+17,shawnzywonzie,2023/4/21 ‰∏ãÂçà3:27,2023/4/21,Yup Statbot is a good one. Deff recommend if you want to dial in to your Discord activity üôÇ,,,,,
4.91769E+17,Statbot#3472,2023/4/21 ‰∏ãÂçà4:31,2023/4/21,,https://cdn.discordapp.com/attachments/1036975360551702568/1099069977224548462/server.png,,,,
4.03431E+17,ka9#2013,2023/4/21 ‰∏ãÂçà5:29,2023/4/21,"‚ú?,"",""
785612634514915338""",zion9999,2023/4/21 ‰∏ãÂçà6:10,hello hello!,,
7.85613E+17,zion9999,2023/4/21 ‰∏ãÂçà6:10,2023/4/21,i need some help with Node.js,,,,,
7.85613E+17,zion9999,2023/4/21 ‰∏ãÂçà6:10,2023/4/21,I had CHATgpt4 help me with a code for a DAO im creating,,,,,
7.85613E+17,zion9999,2023/4/21 ‰∏ãÂçà6:11,2023/4/21,but i'm as new as can be to node.js,,,,,
8.12014E+17,siddesh.eth,2023/4/22 ‰∏äÂçà3:12,2023/4/22,is there a graphql api for fetching all the proposals for a particular dao in aragon?,,,,,
8.12014E+17,siddesh.eth,2023/4/22 ‰∏äÂçà3:15,2023/4/22,"im super new to aragon, just tried out the app",,,,,
4.74566E+17,sagamore,2023/4/22 ‰∏äÂçà3:28,2023/4/22,Where do I report a security issue?,,,,,
9.0972E+17,abuusama,2023/4/22 ‰∏äÂçà4:48,2023/4/22,"there is but you are better of using the SDK https://devs.aragon.org/docs/sdk/
or if you are using react then https://use-aragon.daobox.app/useFetchProposals (last one is a shameless plug since i wrote that library üòÇ )",,,,,
9.0972E+17,abuusama,2023/4/22 ‰∏äÂçà4:51,2023/4/22,Started a thread.,,,,,
9.0972E+17,abuusama,2023/4/22 ‰∏äÂçà4:54,2023/4/22,Started a thread.,,,,,
7.17395E+17,The Coin Oracle#8519,2023/4/23 ‰∏äÂçà10:07,2023/4/23,"Guys, someone has changed the tokenvotingproposal type for the subgraph query, changing a field from executable to potentiallyExecutable, this little change broke my entire application as the subgraph query now fails, does anyone know how to fix it? It seams aragon updated the type and filed but not in graphql, since I redeployed my app it picked up the owx change automatically and do not know how to fix it now...",,,,,
2.46936E+17,markfia,2023/4/23 ‰∏äÂçà10:08,2023/4/23,"Guy when you created your dao in polygon, did you encounter something similar to this error? I‚Äôm stuck and can‚Äôt continue",,,,,
2.46936E+17,markfia,2023/4/23 ‰∏äÂçà10:08,2023/4/23,,https://cdn.discordapp.com/attachments/1036975360551702568/1099698351181664266/IMG_7314.png,,,,
2.46936E+17,markfia,2023/4/23 ‰∏äÂçà10:08,2023/4/23,Have no matic on the connected wallet (fixed),,,,,
7.17395E+17,The Coin Oracle#8519,2023/4/23 ‰∏äÂçà10:09,2023/4/23,This is exactly what @Abu Usama | +4 UTC you showed few message above when talking about the subgraph for proposals...,,,,,
7.17395E+17,The Coin Oracle#8519,2023/4/23 ‰∏äÂçà10:11,2023/4/23,"I get ""Type `TokenVotingProposal` has no field `potentiallyExecutable`""
 Now when I execute the graphql query",,,,,
7.17395E+17,The Coin Oracle#8519,2023/4/23 ‰∏äÂçà10:14,2023/4/23,Guess you changed the graphql url now?,,,,,
2.46936E+17,markfia,2023/4/24 ‰∏äÂçà3:57,2023/4/24,Now that I have the dao created one user with 100% of tokens. I would like to: use api to access token balance in a website. Can someone guide me to this mvp?,,,,,
2.46936E+17,markfia,2023/4/24 ‰∏äÂçà3:57,2023/4/24,Where do I create the api?,,,,,
8.07644E+17,shawnzywonzie,2023/4/24 ‰∏äÂçà11:06,2023/4/24,"Have you checked our developer documents? This may answer some of your questions.

https://devs.aragon.org/",,,,,
4.56227E+17,Deleted User,2023/4/24 ‰∏ãÂçà2:12,2023/4/24,Is anyone having an issue creating a proposal?  I tried to create a proposal on a testnet deployment and the transaction couldn't estimate gas or process.,,,,,
4.56227E+17,Deleted User,2023/4/24 ‰∏ãÂçà2:12,2023/4/24,Here is the testnet deployment if that's helpful: https://app.aragon.org/#/daos/goerli/0x34a6cc358f7c4fb10466aba7b79172ee2a65a4f9/dashboard,,,,,
8.07644E+17,shawnzywonzie,2023/4/24 ‰∏ãÂçà2:24,2023/4/24,Started a thread.,,,,,
8.80794E+17,juliettech,2023/4/24 ‰∏ãÂçà8:31,2023/4/24,Started a thread.,,,,,
7.85613E+17,zion9999,2023/4/25 ‰∏ãÂçà12:25,2023/4/25,Hey,,,,,
7.85613E+17,zion9999,2023/4/25 ‰∏ãÂçà12:25,2023/4/25,i built the DAO,,üöÄ (3),,,
7.85613E+17,zion9999,2023/4/25 ‰∏ãÂçà12:25,2023/4/25,I'm trying to add member wallets,,,,,
8.07644E+17,shawnzywonzie,2023/4/25 ‰∏ãÂçà12:28,2023/4/25,"Glad to hear! Have you watched this video?

https://youtu.be/ua1eCHlJkwQ

When adding additional wallets after the intial creation of your DAO, it will prompt you to create a proposal. This will need to pass before the additional addresses are added. üôÇ",,üëç (1),,,
6.15996E+17,Leoleo#6013,2023/4/27 ‰∏ãÂçà5:31,2023/4/27,"Hey, guys! Is there a list of Plugins currently being built up by the community?",,,,,
8.07644E+17,shawnzywonzie,2023/4/28 ‰∏äÂçà8:48,2023/4/28,Started a thread.,,,,,
8.69178E+17,whattofarm,2023/5/1 ‰∏ãÂçà12:07,2023/5/1 ,Hey guys! Who can I contact to discuss the partnership? We make cool and fast charts for DeFi!,,,,,
8.47437E+17,0xraiseup,2023/5/3 ‰∏äÂçà11:49,2023/5/3 ,Hi. Really interested,,,,,
8.07644E+17,shawnzywonzie,2023/5/3 ‰∏äÂçà11:50,2023/5/3 ,Started a thread.,,,,,
1.03861E+18,Apollo Store#2647,2023/5/5 ‰∏äÂçà7:38,2023/5/5 ,Hello @Shawnzy I have a problem with my DAO community. My DAO not found. What's happened with that?,,,,,
8.80794E+17,juliettech,2023/5/5 ‰∏äÂçà9:04,2023/5/5 ,Started a thread.,,,,,
1.09467E+18,notsurecourselearner,2023/5/5 ‰∏ãÂçà4:39,2023/5/5 ,I am trying to run https://github.com/juliettech13/aragonOSx-sdk-demo,,,,,
1.09467E+18,notsurecourselearner,2023/5/5 ‰∏ãÂçà4:40,2023/5/5 ,"but I am unable to. I am getting the following error.

`TypeError: Cannot read properties of undefined (reading 'web3Providers')`",,,,,
1.09467E+18,notsurecourselearner,2023/5/5 ‰∏ãÂçà4:47,2023/5/5 ,"I have the following entry in AragonSDK.tsx
@juliettech 

`

      const aragonSDKContextParams: ContextParams = {
                network: 'goerli',
                signer,
               daoFactoryAddress: '0x16B6c6674fEf5d29C9a49EA68A19944f5a8471D3',
               web3Providers: ['https://rpc.ankr.com/eth_goerli'],
               ipfsNodes: [
                {
                  url: 'https://testing-ipfs-0.aragon.network/api/v0',
                  headers: { 'X-API-KEY': process.env.IPFS_KEY || '' }
                },
           ],
         graphqlNodes: [
           {
          url: 'https://subgraph.satsuma-prod.com/${process.env.GRAPH_KEY}/aragon/osx-goerli/api'
          }
       ]
     };

`",,,,,
9.0972E+17,abuusama,2023/5/5 ‰∏ãÂçà11:52,2023/5/5 ,Started a thread.,,,,,
6.00238E+17,olivier1977,2023/5/8 ‰∏äÂçà10:24,2023/5/8 ,"Is it me, or are non-transferable governance tokens no longer possible with the new OS (like it used to be with membership or reputation based with the former client).",,,,,
9.0972E+17,abuusama,2023/5/8 ‰∏äÂçà10:30,2023/5/8 ,"They are possible, don't think it's available in the ui but they are defo possible",,,,,
9.0972E+17,abuusama,2023/5/8 ‰∏äÂçà10:32,2023/5/8 ,"Afaik the current version of the ui is a early release, there is a lot coming down the road. I think the thinking around this version is not to have feature parity with client but to have a jumping off point with the new protocol. Under the hood the protocols are very different",,,,,
9.0972E+17,abuusama,2023/5/8 ‰∏äÂçà10:33,2023/5/8 ,You can do way more with the new protocol the front end will catch up,,,,,
4.57717E+17,funguy123,2023/5/8 ‰∏äÂçà10:41,2023/5/8 ,Is there a Url for the subgraph on polygon?,,,,,
2.10379E+17,plopmenz,2023/5/8 ‰∏äÂçà10:52,2023/5/8 ,https://aragonorg.notion.site/SDK-environment-4ee7d17ec26441a8b8b4afcb6ab466b4,,üëåüèΩ (1),,,
2.10379E+17,plopmenz,2023/5/8 ‰∏äÂçà10:57,2023/5/8 ,"Working on this in my plugin too actually, can send you the link if you are interested, but will probably take a few more weeks until it has a pleasant user experience hehe",,"crazyeyes (1),üî• (1),üöÄ (1)",,,
9.0972E+17,abuusama,2023/5/8 ‰∏äÂçà11:07,2023/5/8 ,i wouldn't mint having a look at that,,"üòõ (1),‚ù§Ô∏è (1)",,,
4.56227E+17,Deleted User,2023/5/8 ‰∏äÂçà11:56,2023/5/8 ,"Thinking through a token distribution method for a DAO powered by Aragon...

Any thoughts?

I considered minting the full amount of tokens to a token supply wallet and allowing any Ethereum address to create a proposal in the DAO.

The token supply wallet would drop tokens into the DAO Treasury.

When someone wants to join, they would send ETH to the DAO Treasury and request tokens in the same proposal.  If the exchange rate is correct, the proposal would be passed by the token supply wallet (it would have the ability to pass or block any proposal by virtue of it's voting power until the tokens are fully distributed).",,,,,
4.56227E+17,Deleted User,2023/5/8 ‰∏äÂçà11:56,2023/5/8 ,Has anyone tried this?,,,,,
1.01386E+18,ketuljaypatel,2023/5/8 ‰∏ãÂçà12:26,2023/5/8 ,"We needed a NTT to combine with an ERC20 governance token (NTT to determine membership/ability to vote and ERC20 to determine voting power) we recently built this in a plugin but are cleaning things up before deploying to mainnet (maybe a week or 2) -- If you don't want the dual voting system though, you could just create a NTT and feed the address into the token voting system for a new DAO and it should work (no need for a plugin or anything else fancy)",,,,,
2.10379E+17,plopmenz,2023/5/8 ‰∏ãÂçà1:51,2023/5/8 ,"Currently working on a big pull request to make it a lot more developer friendly, but feel free to take a look üëÄ 
Lemme know if there is anything that catches your eye ü§ó 
Plugin Repo: https://github.com/SecureSECODAO/diamond-governance
Demo: https://github.com/Plopmenz/diamond-governance-demo
Also have a presentation now if you like ü§£",,"Rocket (1),üî• (1)",,,
